"Kakao Friends สิ่งที่ปรารถนาคือเวลาเลิกงาน","nanazenislovingShop",Kwan,NongKwanSuayMak-2021-SEPTEMBER-29-162513.png,"สนุกมากเลยค่ะ",5
"หากคุณตกหลุมรักทกโกซม","NongKwanSuayMak Shop",coolfreewerx,coolfreewerx-2021-SEPTEMBER-27-143144.png,"สนุกจังเลยคะ ติดตามน่ะค่ะ อิอิ จุ๊บๆ <3",3
"หากคุณตกหลุมรักทกโกซม","NongKwanSuayMak Shop",coolfreewerx,coolfreewerx-2021-SEPTEMBER-27-143144.png,"เจคหน้าโง่ อิอิอิอิอิอิอิอิอิอิอิ",2
"หากคุณตกหลุมรักทกโกซม","NongKwanSuayMak Shop",coolfreewerx,coolfreewerx-2021-SEPTEMBER-27-143144.png,"เจคหน้าโง่ อิอิอิอิอิอิอิ ปล่อยบัคทุกวันเลยน้า  ^-------^",5
"Kakao Friends สิ่งที่ปรารถนาคือเวลาเลิกงาน","nanazenislovingShop",mommiNongLisa,mommiNongLisa-2021-SEPTEMBER-29-164236.png,"พี่ว่าดีหนูก็ว่าดี",5
"Kakao Friends สิ่งที่ปรารถนาคือเวลาเลิกงาน","NongKwanSuayMak Shop",Kwan,NongKwanSuayMak-2021-SEPTEMBER-29-162513.png,"เริ่ดนะทำเป็นเล่น",4
"หากคุณตกหลุมรักทกโกซม","NongKwanSuayMak Shop",Kwan,NongKwanSuayMak-2021-SEPTEMBER-29-162513.png,"มิตรภาพก็แค่ชื่อถนน",5
"MIND MAP ศัพท์จีนแบบเน้นๆ","NongKwanSuayMak Shop",Xiao,Xiao-2021-SEPTEMBER-30-1278.png,"หนังสือเหี้ยไรครับเนี่ย อ่านไม่เข้าใจ อยากโดนแบนอ่ะ",4
"MIND MAP ศัพท์จีนแบบเน้นๆ","NongKwanSuayMak Shop",Xiao,Xiao-2021-SEPTEMBER-30-1278.png,"เหนื่อยคร้าบน้อนๆ",0
